Liber TertiusDe interna consolatine.	THE THIRD BOOK ON INWARD CONSOLATION
Cap. I.  Incipit liber de interna consolatine.	CHAPTER I Of the inward voice of Christ to the faithful soul
1.Audiam quid loquatur in me Dominus meus.Beata anima quæ Dominum in se loquentem audit et de ore ejus verbum consolationis accipit. Beatæ aures quæ divini susurri venas suscipiunt et de mundi hujus susurrationibus nihil advertunt. Beatæ plane aures quæ non vocem foris sonantem, sed interius auscultant veritatem loquentem et docentem. Beati oculi qui exterioribus clausi sunt, interioribus autem intenti. Beati qui interna penetrant, et ad capienda arcana cælestia magis ac magis per quotidiana exercitia se student præparare. Beati qui Deo vacare gestiunt et ab omni impedimento sæculi se excutiunt.	1. I will hearken what the Lord God shall say within me. Blessed is the soul which heareth the Lord speaking within it, and receiveth the word of consolation from His mouth. Blessed are the ears which receive the echoes of the soft whisper of God, and turn not aside to the whisperings of this world. Blessed truly are the ears which listen not to the voice that soundeth without, but to that which teacheth truth inwardly. Blessed are the eyes which are closed to things without, but are fixed upon things within. Blessed are they who search inward things and study to prepare themselves more and more by daily exercises for the receiving of heavenly mysteries. Blessed are they who long to have leisure for God, and free themselves from every hindrance of the world. Think on these things, O my soul, and shut the doors of thy carnal desires, so mayest thou hear what the Lord God will say within thee.
2. Animadverte hoc, o anima mea, et claude sensualitatis tuæ ostia, ut possis audire quid loquatur Deus Dominus in te. Hæc dicit dilectus tuus. Salus tua ego sum, pax tua, et vita tua. Serva te apud me, et pacem invenies. Dimitte omnia transitoria, et quære æterna. Quid sunt omnia temporalia, nisi seductoria et quid juvant omnes creaturæ, si fueris a Creatore deserta? Omnibus ergo abdicatis Creatori tuo te redde placitam et fidelem, ut veram valeas apprehendere beatitudinem.	2. These things saith thy Beloved, “I am thy salvation, I am thy peace and thy life. Keep thee unto Me, and thou shalt find peace.” Put away thee all transitory things, seek those things that are eternal. For what are all temporal things but deceits, and what shall all created things help thee if thou be forsaken by the Creator? Therefore put all things else away, and give thyself to the Creator, to be well pleasing and faithful to Him, that thou mayest be able to attain true blessedness.
Cap. 2. Quod veritas intus loquitur sine strepitu.	CHAPTER II What the truth saith inwardly without noise of words
1.Loquere Domine, quia audit servus tuus. Servus tuus ego sum, da mihi intellectum, ut sciam testimonia tua.Inclina cor meum in verba oris mei. Fluat ut ros eloquium tuum, dicebant olim filii Israel ad Moysen.Loquere nobis tu, et audiemus; non loquatur Dominus nobis, ne forte moriamur.Non sic, Domine, non sic oro, sed magis cum Samuele popheta humiliter ad disideranter obsecro.Loquere Domine, quia audit servus suus.Non loquatur Moyses mihi, aut aliquis ex Prophetis, sed otius tu loquere, Domine Deus, inspirator et illuminator omnium. Prophetarum, quia tu solus sine eis potes me perfecte imbuere, illi autem sine te nihil proficient.	1. Speak Lord, for thy servant heareth. I am Thy servant; O give me understanding that I may know Thy testimonies. Incline my heart unto the words of Thy mouth. Let thy speech distil as the dew. The children of Israel spake in old time to Moses, Speak thou unto us and we will hear, but let not the Lord speak unto us lest we die. Not thus, O Lord, not thus do I pray, but rather with Samuel the prophet, I beseech Thee humbly and earnestly, Speak, Lord, for Thy servant heareth. Let not Moses speak to me, nor any prophet, but rather speak Thou, O Lord, who didst inspire and illuminate all the prophets; for Thou alone without them canst perfectly fill me with knowledge, whilst they without Thee shall profit nothing.
2. Possunt quidem verba sonare, sed spiritum non conferunt. Pulcherrime dicunt, sed te tacente cor non accedunt. Litteras tradunt, sed tu sensum aperis. Mysteria referunt, sed tu referas intellectum signatorum. Mandata edunt, sed tu juvas ad perficiendum. Viam ostendunt, sed tu confortas ad ambulandum. Illi foris tantum agunt, sed tu corda instruis, et illuminas. Illi exterius rigant, sed tu fecunditatem donas. Illi clamant verbis, sed tu auditui intelligentiam tribuis.	2. They can indeed utter words, but they give not the spirit. They speak with exceeding beauty, but when Thou art silent they kindle not the heart. They give us scriptures, but Thou makest known the sense thereof. They bring us mysteries, but Thou revealest the things which are signified. They utter commandments, but Thou helpest to the fulfilling of them. They show the way, but Thou givest strength for the journey. They act only outwardly, but Thou dost instruct and enlighten the heart. They water, but Thou givest the increase. They cry with words, but Thou givest understanding to the hearer.
3. Non ergo mihi loquatur Moyses, sed tu, Domine Deus meus, æterna veritas, ne forte moriar, et sine fructu efficiar, si fuero tantum foris admonitus, et intus non accensus, ne sit mihi ad judicium verbum auditum, et non factum cognitum nec amatum creditum, et non servatum.Loquere igitur, Domine, quia audit servus tuus: verba enim vitæ æternæ habes.Loquere mihi ad qualemcumque animæ meæ consolationem, et ad totius vitæ meæ emendationem, tibi autem ad gloriam et perpetuum honorem.	3. Therefore let not Moses speak to me, but Thou, O Lord my God, Eternal Truth; lest I die and bring forth no fruit, being outwardly admonished, but not enkindled within; lest the word heard but not followed, known but not loved, believed but not obeyed, rise up against me in the judgment. Speak, Lord, for Thy servant heareth; Thou hast the words of eternal life.(4) Speak unto me for some consolation unto my soul, for the amendment of my whole life, and for the praise and glory and eternal honour of Thy Name.
Cap. 3. Quod verba Dei sunt audienda cum humilitate.	CHAPTER III How all the words of God are to be heard with humility
1. Audi, fili mi, verba mea. Verba mea suavissima sunt, Philosophorum et Sapientum hujus mundi scientam excedentia. Verba mea spiritus et vita sunt, nec humano sunsu pensanda; non sunt ad vanam complacentiam trahenda, sed in silentio audienda, et cum omni humilitate, atque affectu magno suscipienda. Et dixi: Beatus quem tu erudieris, Domine, et de lege tua docueris eum, ut mitiges ei a diebus maliset desoletur in terra.	1. “My Son, hear My words, for My words are most sweet, surpassing all the knowledge of the philosophers and wise men of this world. My words are spirit, and they are life, and are not to be weighed by man’s understanding. They are not to be drawn forth for vain approbation, but to be heard in silence, and to be received with all humility and with deep love.” And I said, “Blessed is the man whom Thou teachest, O Lord, and instructest him in Thy law, that Thou mayest give him rest in time of adversity, and that he be not desolate in the earth.”
2. Ego, inquit Dominus, docui Prophetas ab initio, et usque nunc non cesso omnibus loqui. Sed multi ad vocem meam surdi sunt, et muti et duri. Plures mundum libentius audiunt quam Deum, facilius sequuntur carnis suæ appetitum, quam dei beneplacitum. Promittit temporalia, et parva mundus, et servitur ei aviditate magna. Ego promitto summa, et æterna, et torpescunt mortalium corda. Quis tanta cura in omnibus mihi servit et obedit, sicut mundo et dominis ejus servitur?Erubesce, Sidon, ait mare.Et si causam quæris audi, quare. Pro modica præbenda longa via curritur, pro vita æterna vix a multis pes a terra semel movetur et levatur. Vile prætium quæritur, pro uno numismate interdum turpiter litigatur, pro vana re et parva promissione die noctuque fatigari non timetur.	2. “I,” saith the Lord, “taught the prophets from the beginning, and even now cease I not to speak unto all; but many are deaf and hardened against My voice; many love to listen to the world rather than to God, they follow after the desires of the flesh more readily than after the good pleasure of God. The world promiseth things that are temporal and small, and it is served with great eagerness. I promise things that are great and eternal, and the hearts of mortals are slow to stir. Who serveth and obeyeth Me in all things, with such carefulness as he serveth the world and its rulers? Be thou ashamed, O Sidon, saith the sea; And if thou reason seekest, hear thou me. For a little reward men make a long journey; for eternal life many will scarce lift a foot once from the ground. Mean reward is sought after; for a single piece of money sometimes there is shameful striving; for a thing which is vain and for a trifling promise, men shrink not from toiling day and night.”
3. Sed, proh dolor, pro bono incommutabili, pro prætio inæstimabili, pro summo honore et gloria interminabili vel ad modicum fatigari pigritatur. Erubesce ergo, serve piger et querulose, quod illi paratiores inveniuntur ad perditionem, quam te ad vitam; gaudent illi amplius ad vanitatem, quam tu ad veritatem. Equidem a spe sua nonnunquam frustrantur, sed promissio mea neminem fallit, nec confitentem mihi dimittit inanem. Quod promisi dabo, quod dix implebo, si tamen usque ad finem fidelis in dilectione mea quis permanserit. Ego remunerator sum omnium bonorum, et fortis probator omnium devotorum.	3. “But, O shame! for an unchangeable good, for an inestimable reward, for the highest honour and for a glory that fadeth not away, it is irksome to them to toil even a little. Be thou ashamed therefore, slothful and discontented servant, for they are found readier unto perdition than thou unto life. They rejoice more heartily in vanity than thou in the truth. Sometimes, indeed, they are disappointed of their hope, but my promise faileth no man, nor sendeth away empty him who trusteth in Me. What I have promised I will give; what I have said I will fulfil; if only a man remain faithful in My love unto the end. Therefore am I the rewarder of all good men, and a strong approver of all who are godly.
4. Scribe verba mea in corde tuo, et pertracta diligenter: erunt enim in tempore tentationis valde necessaria. Quod non intelligis, cum legis, cognosces in die visitationis. Dupliciter soleo electos meos visitare, tentatione scilicet et consolatione: et duas lectiones eis quotidie lego, unam increpando eorum vittia, alteram exhortando ad virtutum incrementa. Qui habet verba mea et spernit ea,habet qui judicet eum in novissimo die.	4. “Write My words in thy heart and consider them diligently, for they shall be very needful to thee in time of temptation. What thou understandest not when thou readest, thou shalt know in the time of thy visitation. I am wont to visit Mine elect in twofold manner, even by temptation and by comfort, and I teach them two lessons day by day, the one in chiding their faults, the other in exhorting them to grow in grace. He who hath My words and rejecteth them, hath one who shall judge him at the last day.”
Oratio ad imporandum devotionis gratiam.	A PRAYER FOR THE SPIRIT OF DEVOTION
5. Domine Deus meus, tu es omnia bona mea. Et quis ego sum, ut audeam ad te loqui? Ego sum pauperrimus servulus tuus, et abjectus vermiculus tuus, multo pauperior et contemptibilior, quam scio et dicere audeo. Memento tamen, Domine, quia nihil sum, nihil valeo, nihilque habeo. Tu solus bonus justus et sanctus; tu omnia potes, omnia præstas, omnia imples, solum peccatorem inanem relinquens. Reminiscere miserationum tuarum, Domine, et imple gratia tua cor ceum, qui non vis vacua esse opera tua.	5. O Lord my God, Thou art all my good, and who am I that I should dare to speak unto Thee? I am the very poorest of Thy servants, an abject worm, much poorer and more despicable than I know or dare to say. Nevertheless remember, O Lord, that I am nothing, I have nothing, and can do nothing. Thou only art good, just and holy; Thou canst do all things, art over all things, fillest all things, leaving empty only the sinner. Call to mind Thy tender mercies, and fill my heart with Thy grace, Thou who wilt not that Thy work should return to Thee void.
6. Quomodo possum me tolerare in hac misera vita, nisi me confortaveris misericordia tua et gratia tua. Noli avertere faciem tuam a me, noli visitationem tuam prolongare, noli consolationem tuam prolongare, noli consolationem tuam abstrahere, ne fiatanima mea sicut terra sine aqua tibi. Doce me,Domine,facere voluntatem tuam.Doce me coram te digne et humiliter conversari, quia sapientia mea tu es, qui in veritate me cognoscis, et cognovisti antequam fieret mundus, et antequam natus essem in mundo.	6. How can I bear this miserable life unless Thy mercy and grace strengthen me? Turn not away Thy face from me, delay not Thy visitation. Withdraw not Thou Thy comfort from me, lest my soul “gasp after thee as a thirsty land.” Lord, teach me to do Thy will, teach me to walk humbly and uprightly before Thee, for Thou art my wisdom, who knowest me in truth, and knewest me before the world was made and before I was born into the world.
Cap. 4. Quod in humilitate et veritate coram Deo est conversandum.	CHAPTER IV How we must walk in truth and humility before God
1. Fili, ambula coram me in veritate et in simplicitate cordis tui quære me semper. Qui ambulat coram me in veritate, tutabitur ab incursibus vanis et veritas liberabit eum a seductoribus et detractionibus iniquorum. Si veritas te liberaverit, vere liber eris et non curabis de vanis hominum verbis. Domine verum est ut dicis, ita quæso mecum fiat. Veritas tua ipsa me doceat, ipsa me custodiat, et usque ad salutarem finem me conservet; ipsa me liberet ab omni affectione mala et inordinata at ambulabo tecum in magna cordis libertate.	1. “My Son! walk before Me in truth, and in the simplicity of thy heart seek Me continually. He who walketh before Me in the truth shall be safe from evil assaults, and the truth shall deliver him from the wiles and slanders of the wicked. If the truth shall make thee free, thou shalt be free indeed, and shalt not care for the vain words of men.” Lord, it is true as Thou sayest; let it, I pray Thee, be so with me; let Thy truth teach me, let it keep me and preserve me safe unto the end. Let it free me from all evil and inordinate affection, and I will walk before Thee in great freedom of heart.
2. Ego te docebo, ait Veritas, quæ recta sunt et placita coram me. Cogita peccata tua cum displicentia magna et memorare, et nuquam reputes te aliquid esse propter opera bona. Revera peccator es, et multis passionibus obnoxius, et implicatus. Ex te semper ad nihil tendis, cito laberis, cito turbaris, cito dissolveris. Non habes quidquam, unde possis gloriari. Sed multa habes unde te debes vilificare, quia multo infirmior es quam vales comprehendere.	2. “I will teach thee,” saith the Truth, “the things which are right and pleasing before Me. Think upon thy sins with great displeasure and sorrow, and never think thyself anything because of thy good works. Verily thou art a sinner, liable to many passions, yea, tied and bound with them. Of thyself thou always tendest unto nothing, thou wilt quickly fall, quickly be conquered, quickly disturbed, quickly undone. Thou hast nought whereof to glory, but many reasons why thou shouldest reckon thyself vile, for thou art far weaker than thou art able to comprehend.
3. Nihil ergo tibi magnum videatur ex omnibus, quæ agis. Nihil grande, nihil prætiosum et admirabile, nil reputatione appareat dignum, nil altum, nil vere laudabile, et desiderabile, nisi quod æternum. Placeat tibi super omnia æterna veritas, displiceat tibi super omnia vilitas maxima tua. Nil sic temeas et fugias, sicut vitia, et peccata tua, quæ magis displicere debent, quam quælibet rerum damna. Quidam non sincere coram me ambulant, sed quadam curiositte et arrogania ducti volunt secreta mea scire, et alta Dei intelligere, se et suam salutem negligentes. Hi sæpe in magnas tentationes, et peccata, propter suam jactantiam, superbiam et curiositatem, labuntur me eis adversante. Time judicia Dei, expavesce iram Omnipotentis.	3. “Let, therefore, nothing which thou doest seem to thee great; let nothing be grand, nothing of value or beauty, nothing worthy of honour, nothing lofty, nothing praiseworthy or desirable, save what is eternal. Let the eternal truth please thee above all things, let thine own great vileness displease thee continually. Fear, denounce, flee nothing so much as thine own faults and sins, which ought to be more displeasing to thee than any loss whatsoever of goods. There are some who walk not sincerely before me, but being led by curiosity and pride, they desire to know my secret things and to understand the deep things of God, whilst they neglect themselves and their salvation. These often fall into great temptations and sins because of their pride and curiosity, for I am against them.
4. Noli autem discutere opera Altissimi, sed tuas iniquitates perscrutare, in quantis dereliquisti, et quam multa bona neglexisti. Quidam portant solum suam devotionem in libris, quidam in imaginibus; quidam autem in signis exterioribus et figuris. Quidam habent me in ore, sed modicum in corde. Sunt alii qui intellectu illuminati et affectu purgati ad æterna sempe anhelant, de terrenis graviter audiunt, necessitatibus naturæ dolenter inserviunt, et hi sentiunt, quid veritatis spiritus loquitur in eis. Quia docet eos terrena despicere, et amare cælestia, mundum negligere, et cælum tota die et nocte desiderare.	4. “Fear thou the judgments of God, fear greatly the wrath of the Almighty. Shrink from debating upon the works of the Most High, but search narrowly thine own iniquities into what great sins thou hast fallen, and how many good things thou hast neglected. There are some who carry their devotion only in books, some in pictures, some in outward signs and figures; some have Me in their mouths, but little in their hearts. Others there are who, being enlightened in their understanding and purged in their affections, continually long after eternal things, hear of earthly things with unwillingness, obey the necessities of nature with sorrow. And these understand what the Spirit of truth speaketh in them; for He teacheth them to despise earthly things and to love heavenly; to neglect the world and to desire heaven all the day and night.”
Cap. 5. De mirabili affectu divini amoris.	CHAPTER V Of the wonderful power of the Divine Love
1. Benedico te, Pater cælestis, Pater Domini mei Jesu Christi, qui mei pauperis dignatus es recordari. O, Pater misericordiarum, et Deus totius consolationis, gratias tibi ago, qui me indignum omni consolatione quandoque tua recreas consolatione. Benedico te semper et glorifico cum unigenito Filio tuo, et Spiritu Sancto paracleto in sæcula sæculorum, amen. Eia, Domine Deus, meus amator sancte, cum tu veneris in cor meum, exultabunt omnia interiora mea. Tu es gloria mea et exultatio cordis mei, tu spes mea et refugium in die tribulationis meæ.	1. I bless Thee, O Heavenly Father, Father of my Lord Jesus Christ, for that Thou hast vouchsafed to think of me, poor that I am. O, Father of Mercies and God of all comfort, I give thanks unto Thee, who refreshest me sometimes with thine own comfort, when I am unworthy of any comfort. I bless and glorify Thee continually, with thine only begotten Son and the Holy Ghost, the Paraclete, for ever and ever. O Lord God, Holy lover of my soul, when Thou shalt come into my heart, all my inward parts shall rejoice. Thou art my glory and the joy of my heart. Thou art my hope and my refuge in the day of my trouble.
2. Sed quia adhuc debilis sum in amore et impefectus in virtute, ideo necesse habeo confortari et consolari. Propterea visita me sæpius, et instrue disciplinis tuis. Libera me a passionibus pravis et malis, et sana cor meum ab omnibus affectionibus inordinatis, ut intus sanatus et bene purgatus aptus efficiar ad amandum, fortis ad patiendum, stabilis ad perseverandum.	2. But because I am still weak in love and imperfect in virtue, I need to be strengthened and comforted by Thee; therefore visit Thou me often and instruct me with Thy holy ways of discipline. Deliver me from evil passions, and cleanse my heart from all inordinate affections, that, being healed and altogether cleansed within, I may be made ready to love, strong to suffer, steadfast to endure.
3. Magna res est amor, magnum omnino bonum quod solum leve facit esse onerosum, et fert æqualiter omne inæquale: nam onus sine onere portat, et omne amarum dulce ac sapidum efficit. Amor Jesu nobilis ad magna operanda impellit, et desideranda semper perfectiora excitat. Amor vult esse sursum, nec ullis infimis rebus retineri. Amor vult esse liber, et ab omni mundana affectione alienus, ne internus ejus impediatur aspectus; ne per aliquod commodum temporale implicationes sustineat, aut per incommodum succumbat. Nil dulcius est amore, nil fortius, nil altius, nil latius, nil jucundius, nil plenius, nil melius in c&aeliglo et in terra, quia amor a Deo natus est, nec potest nisi in Deo super omnia creata quiescere.	3. Love is a great thing, a good above all others, which alone maketh every heavy burden light, and equaliseth every inequality. For it beareth the burden and maketh it no burden, it maketh every bitter thing to be sweet and of good taste. The surpassing love of Jesus impelleth to great works, and exciteth to the continual desiring of greater perfection. Love willeth to be raised up, and not to be held down by any mean thing. Love willeth to be free and aloof from all worldly affection, lest its inward power of vision be hindered, lest it be entangled by any worldly prosperity or overcome by adversity. Nothing is sweeter than love, nothing stronger, nothing loftier, nothing broader, nothing pleasanter, nothing fuller or better in heaven nor on earth, for love was born of God and cannot rest save in God above all created things.
4. Amans volat, currit, lætatur, liber est, et non tenetur. Dat omnia pro omnibus, et habet omnia in omnibus, quia in uno summo super omnia quiescit, ex quo omne bonum fluit et procedit. Non respicit ad dona, sed ad donantem se convertit super omnia bona. Amor sæpe modum nescit, sed super omne bonum fervescit. Amor onus non sentit, labores non reputat, plus affectat, quam valet, de impossibilitate non causatur, quia cuncta sibi licere posse arbitratur. Valet igitur ad omnia, et multa implet, et effectui mancipat. Ubi vero amans deficit et jacet, amor vigilat, et dormiens dormitat, fatigatus non laxatur, arctatus non arctatur, territus non conturbatur, sed, sicut vivax flamma et ardens favilla, sursum erumpit secureque pertransit.	4. He who loveth flyeth, runneth, and is glad; he is free and not hindered. He giveth all things for all things, and hath all things in all things, because he resteth in One who is high above all, from whom every good floweth and proceedeth. He looketh not for gifts, but turneth himself to the Giver above all good things. Love oftentimes knoweth no measure, but breaketh out above all measure; love feeleth no burden, reckoneth not labours, striveth after more than it is able to do, pleadeth not impossibility, because it judgeth all things which are lawful for it to be possible. It is strong therefore for all things, and it fulfilleth many things, and is successful where he who loveth not faileth and lieth down. Love is watchful, and whilst sleeping still keepeth watch; though fatigued it is not weary, though pressed it is not forced, though alarmed it is not terrified, but like the living flame and the burning torch, it breaketh forth on high and securely triumpheth. 
5. Si quis amat, novit quid hæc vox clamat. Magnus clamor in auribus Dei est ardens affectus animæ, quæ dicit. Deus, Deus meus, amor meus, tu totus meus, et ego tuus.	5. If a man loveth, he knoweth what this voice crieth. For the ardent affection of the soul is a great clamour in the ears of God, and it saith: My God, my Beloved! Thou art all mine, and I am all Thine.
6. Dilata me in amore, ut discam interiori cordis ore degustare, quam suave sit amare et in amore liquefieri et natare. Tenear amore vadens supra me præ nimio fervore et stupore. Cantem amoris canticum; sequar te dilectum meum in altum. Deficit in laude tua anima mea, jubilans ex amore. Amem te plus quam me, nec me nisi propter te, et omnes in te, qui vere amant te, sicut jubet lex amoris, lucens ex te.	6. Enlarge Thou me in love, that I may learn to taste with the innermost mouth of my heart how sweet it is to love, to be dissolved, and to swim in love. Let me be holden by love, mounting above myself through exceeding fervour and admiration. Let me sing the song of love, let me follow Thee my Beloved on high, let my soul exhaust itself in Thy praise, exulting with love. Let me love Thee more than myself, not loving myself except for Thy sake, and all men in Thee who truly love Thee, as the law of love commandeth which shineth forth from Thee.
