2. Etsi omnia bona creata haberes, non posses esse felix et beata; sed in Deo, qui cuncta creavit, tota beatitudo tua et felicitas consistit, non qualis videtur et laudatur a stultis mundi amatoribus, sed qualem exspectant boni Christi fideles, et prægustant interdum spirituales ac mundi corde, quorumconversatio est in cælis. Vanum est et breve omne humanum solatium: beatum et verum solatium, quod intus a veritate percipitur. Devotus homo ubique fert secum consolatorem suum Jesum et dicit ad eum: Adesto mihi, Domine Jesu, in omni loco et tempore. Hæc mihi sit consolatio, libenter velle carere omni humano solatio. Et si tua defuerit consolatio, sit mihi tua voluntas, et justa probatio pro summo solatio.Non in perpetuumenimirasceris, neque in æternum comminaberis.	2. Although thou hadst all the good things which ever were created, yet couldst not thou be happy and blessed; all thy blessedness and thy felicity lieth in God who created all things; not such felicity as seemeth good to the foolish lover of the world, but such as Christ’s good and faithful servants wait for, and as the spiritual and pure in heart sometimes taste, whose conversation is in heaven. All human solace is empty and short-lived; blessed and true is that solace which is felt inwardly, springing from the truth. The godly man everywhere beareth about with him his own Comforter, Jesus, and saith unto Him: “Be with me, Lord Jesus, always and everywhere. Let it be my comfort to be able to give up cheerfully all human comfort. And if Thy consolation fail me, let Thy will and righteous approval be alway with me for the highest comfort. For Thou wilt not always be chiding, neither keepest Thou Thine anger for ever .”
Cap. 17. Quod omnis sollicitudo in Deo ponenda est.	CHAPTER XVII That all care is to be cast upon God
1. Fili, sine me tecum agere quod volo: ego scio quid expediat tibi. Tu cogitas ut homo, in multis sentis, sicut tibi humanus suadet affectus.	1. “My Son, suffer me to do with thee what I will; I know what is expedient for thee. Thou thinkest as a man, in many things thou judgest as human affection persuadeth thee.”
2. Domine, verum est quod dicis. Major est sollicitudo tua pro me, quam omnis cura quam ego possem gerere pro me. Nimis enim casualiter stat, qui non projicit omnem sollicitudinem suam in te. Domine, dummodo voluntas mea recta et firma, in te permaneat, fac de me quidquid tibi placuerit. Non enim potest esse nisi bonum quidquid de me feceris. Si me vis esse in tenebris, sis benedictus; et si me vis esse in luce, sis iterum benedictus. Si me dignaris consolari, sis benedictus; si me vis tribulari, æque sis semper benedictus.	2. Lord, what Thou sayest is true. Greater is Thy care for me than all the care which I am able to take for myself. For too insecurely doth he stand who casteth not all his care upon Thee. Lord, so long as my will standeth right and firm in Thee, do with me what Thou wilt, for whatsoever Thou shalt do with me cannot be aught but good. Blessed be Thou if Thou wilt leave me in darkness: blessed also be Thou if Thou wilt leave me in light. Blessed be Thou if Thou vouchsafe to comfort me, and always blessed be Thou if Thou cause me to be troubled.
3. Fili, sic oportet te stare, si mecum desideras ambulare. Ita promtus debes esse ad patiendum, sicut ad gaudendum. Ita libenter debes esse inops et pauper, sicut plenus, et dives.	3. “My Son! even thus thou must stand if thou desirest to walk with Me. Thou must be ready alike for suffering or rejoicing. Thou must be poor and needy as willingly as full and rich.”
4. Domine, libenter patiar pro te sicut volueris venire super me. Indifferenter volo de manu tua bonum et malum, dulce et amarum, lætum et triste suscipere, et pro omnibus mihi contingentibus gratias agere. Custodi me ab omni peccato, et non timebo mortem neque infernum. Dummodo in æternum non projicias, nec deleas me de libro vitæ, non mihi nocebit quidquid veniret tribulationis super me.	4. Lord, I will willingly bear for Thee whatsoever Thou wilt have to come upon me. Without choice I will receive from Thy hand good and evil, sweet and bitter, joy and sadness, and will give Thee thanks for all things which shall happen unto me. Keep me from all sin, and I will not fear death nor hell. Only cast me not away for ever, nor blot me out of the book of life. Then no tribulation which shall come upon me shall do me hurt.
Cap. 18. Quod temporales miseriæ Christi exemplo æquanimiter sunt ferendæ.	CHAPTER XVIII That temporal miseries are to be borne patiently after the example of Christ
1. Fili, ego descendi de cælo pro tua salute; suscepi tuas miserias, non necessitate, sed charitate trahente ut patientiam disceres et temporales miserias non indignanter ferres. Nam ab hora ortus mei usque ad exitum in cruce non defuit mihi tolerantia doloris, at defectum rerum temporalium magnum habui. Multas querimonias de me frequenter audivi, confusiones et opprobria benigne sustinui, pro miraculis blasphemias, pro doctrina reprehensiones.	1. “My Son! I came down from heaven for thy salvation; I took upon Me thy miseries not of necessity, but drawn by love that thou mightest learn patience and mightest bear temporal miseries without murmuring. For from the hour of My birth, until My death upon the Cross, I ceased not from bearing of sorrow; I had much lack of temporal things; I oftentimes heard many reproaches against Myself; I gently bore contradictions and hard words; I received ingratitude for benefits, blasphemies for My miracles, rebukes for My doctrine.”
2. Domine, quia fuisti patiens in vita tua, in hoc maxime implendo præceptum Patris tui, dignum est ut ego misellus peccator secundum voluntatem tuam patienter me sustineam, et donec ipse volueris, onus corruptibilis vitæ pro salute mea portem. Nam etsi sentitur onerosa præsens vita, facta est tamen jam per gratiam tuam valde meritoria, atque exemplo tuo atque Sanctorum tuorum vestigiis infirmis tolerabilior, et clarior. Sed et multo magis consolatioria, quam olim in veteri Testamento fuerat, cum porta cæli clausa persisteret, et obscurior etiam via videbatur, quando tam pauci regnum cælorum quærere curabant. Sed neque qui tunc justi erant et salvandi ante passionem tuam et sacræ mortis obitum, cæleste regnum poterant introire.	2. Lord, because Thou wast patient in Thy life, herein most of all fulfilling the commandment of Thy Father, it is well that I, miserable sinner, should patiently bear myself according to Thy will, and as long as Thou wilt have it so, should bear about with me for my salvation, the burden of this corruptible life. For although the present life seemeth burdensome, it is nevertheless already made very full of merit through Thy grace, and to those who are weak it becometh easier and brighter through Thy example and the footsteps of Thy saints; but it is also much more full of consolation than it was of old, under the old Testament, when the gate of heaven remained shut; and even the way to heaven seemed more obscure when so few cared to seek after the heavenly kingdom. But not even those who were then just and in the way of salvation were able, before Thy Passion and the ransom of Thy holy Death, to enter the kingdom of heaven.
3. O, quantas tibi gratias teneor referre, quia rectam et bonam viam dignatus es mihi et cinctis fidelibus ad æternum regnum ostendere tuum. Nam vita tua via nostra, et per sanctam patietiam ambulamus ad te, qui es corona nostra. Nisi tu nos præcessisses et docuisses, quis sequi curaret? Heu quanti longe retrocenderent, nisi tua præclara exempla inspicerent. Ecce adhuc tepescimus auditis tot signis tuis et doctrinis. Quid fieret si tantum lumen ad sequendum te non haberemus?	3. Oh what great thanks am I bound to give Thee, who hast vouchsafed to show me and all faithful people the good and right way to Thine eternal kingdom, for Thy way is our way, and by holy patience we walk to Thee who art our Crown. If Thou hadst not gone before and taught us, who would care to follow? Oh, how far would they have gone backward if they had not beheld Thy glorious example! Behold we are still lukewarm, though we have heard of Thy many signs and discourses; what would become of us if we had not such a light to help us follow Thee?
Cap. 19. De tolerantia injuriarum, et quis verus patiens perhibetur.	CHAPTER XIX Of bearing injuries, and who shall be approved as truly patient
1. Quid est quod loqueris o fili? Cessa conqueri, considera meam et aliorum Sanctorum passionem.Nondum usque ad sanguinem restitisti. Parum est quod tu pateris in comparatione eorum, qui tam multa passi sunt, tam fortiter tentati, tam graviter tribulati, tam multipliciter probati, et exercitati. Oportet igitur aliorum graviora ad mentem reducere, ut levius feras tua minima. Et si tibi minima non videntur, vide ne et hoc tua faciat impatientia. Sive tamen parva, sive magna sint, stude cuncta patienter ferre.	1. “What sayest thou, My Son? Cease to complain; consider My suffering and that of My saints. Thou hast not yet resisted unto blood. It is little which thou sufferest in comparison with those who have suffered so many things, have been so strongly tempted, so grievously troubled, so manywise proved and tried. Thou oughtest therefore to call to mind the more grievous sufferings of others that thou mightest bear thy lesser ones more easily, and if they seem not to thee little, see that it is not thy impatience which is the cause of this. But whether they be little or whether they be great, study to bear them all with patience.
2. Quanto melius te ad patiendum disponis, tanto sapientius agis, et amplius promereris et feres levius animo et usu ad hoc non segniter paratus. Nec dica: Non valeo hæc ab homine tali pati, nec hujuscemodi mihi patienda sunt: grave enim intulit damnum, et improperat mihi quæ nunquam cogitaveram; sed ab alio libenter patiar, et sicut patienda videro. Insipiens est talis cogitatio, quæ virtutem patientiæ non considerat, nec a quo coronanda erit; sed magis personas, et offensas sibi illatas perpendit.	2. “So far as thou settest thyself to bear patiently, so far thou dost wisely and art deserving of the more merit; thou shalt also bear the more easily if thy mind and habit are carefully trained hereunto. And say not ‘I cannot bear these things from such a man, nor are things of this kind to be borne by me, for he hath done me grievous harm and imputeth to me what I had never thought: but from another I will suffer patiently, such things as I see I ought to suffer.’ Foolish is such a thought as this, for it considereth not the virtue of patience, nor by whom that virtue is to be crowned, but it rather weigheth persons and offences against self.
3. Non est verus patiens qui non vult pati, nisi quantum sibi visum fuerit, et a quo sibi placuerit. Verus autem patiens non attendit a quo homine, utrum a Prælato suo, an ab alio æquali, an inferior, utrum a bono, et sancto viro, vel a perverso, et indigno exerceatur. Sed indifferenter ab omni creatura, quantumcumque et quotiescumque ei aliquid adversi acciderit, totum hoc gratanter de manu Dei accipit, et ingens lucrum reputat, quia nihil apud Deum, quantumlibet parvum pro Deo tamen passum, poterit sine merito transire.	3. “He is not truly patient who will only suffer as far as seemeth right to himself and from whom he pleaseth. But the truly patient man considereth not by what man he is tried, whether by one above him, or by an equal or inferior, whether by a good and holy man, or a perverse and unworthy; but indifferently from every creature, whatsoever or how often soever adversity happeneth to him, he gratefully accepteth all from the hand of God and counteth it great gain: for with God nothing which is borne for His sake, however small, shall lose its reward.
4. Esto igitur expeditus ad pugnam, si vis habere victoriam. Sine certamine non potes venire ad patientiæ coronam; si pati non vis, recusas coronari. Si autem coronari desideras, certa viriliter, sustine patienter. Sine labore non tenditur ad requiem, nec sine pugna pervenitur ad victoriam.	4. “Be thou therefore ready for the fight if thou wilt have the victory. Without striving thou canst not win the crown of patience; if thou wilt not suffer thou refusest to be crowned. But if thou desirest to be crowned, strive manfully, endure patiently. Without labour thou drawest not near to rest, nor without fighting comest thou to victory.”
5. Fac mihi possibile, Domine, per gratiam, quod mihi impossibiel videtur per naturam. Tu scis quod modicum possum pati, et quod cito dejicior, levi exsurgente adversitate. Efficiatur mihi quælibet exercitatio tribulationis, pro nomine tuo amabilis, et acceptabilis: nam pati et vexari pro te valde salubre est animæ meæ.	5. Make possible to me, O Lord, by grace what seemeth impossible to me by nature. Thou knowest how little I am able to bear, and how quickly I am cast down when a like adversity riseth up against me. Whatsoever trial of tribulation may come to me, may it become unto me pleasing and acceptable, for to suffer and be vexed for Thy sake is exceeding healthful to the soul.
Cap. 20. De confessione propriæ infirmitatis, et hujus vitæ miseriis.	CHAPTER XX Of confession of our infirmity and of the miseries of this life
1.Confiteor adversum me injustitiam meam; confitebor tibi, Domini, infirmitatem meam. Sæpe parva res est quæ dejicit et contristat. Præpono me firmiter acturum, sed cum modica tentatio venerit, magis mihi sit angustia. Valde vilis quandoque res est, unde gravis tentatio provenit; dum puto me aliquantulum tutum, cum non sentio, invenio me nonnunquam pæne devictum ex levi flatu.	1. I will acknowledge my sin unto Thee; I will confess to Thee, Lord, my infirmity. It is often a small thing which casteth me down and maketh me sad. I resolve that I will act bravely, but when a little temptation cometh, immediately I am in a great strait. Wonderfully small sometimes is the matter whence a grievous temptation cometh, and whilst I imagine myself safe for a little space; when I am not considering, I find myself often almost overcome by a little puff of wind.
2. Vide ergo, Domine, humilitatem meam, et fragilitatem tibi undique notam. Miserere mei, eteripe me de luto, ut non infigar, non permaneam devictus usquequaque. Hoc est quod me frequenter reverberat, et coram te confundit, quod tam labilis sum, et infirmus ad resistendum passionibus, et si non omnino ad consensionem, tamen mihi etiam molesta et gravis est earum infectatio, et tædet valde sic quotidie vivere in lite. Exhinc nota sit mihi infirmitas mea, quia multo facilius irrunt abominandæ semper phantasiæ, quam discedunt.	2. Behold, therefore, O Lord, my humility and my frailty, which is altogether known to Thee. Be merciful unto me, and draw me out of the mire that I sink not , lest I ever remain cast down. This is what frequently throweth me backward and confoundeth me before Thee, that I am so liable to fall, so weak to resist my passions. And though their assault is not altogether according to my will, it is violent and grievous, and it altogether wearieth me to live thus daily in conflict. Herein is my infirmity made known to me, that hateful fancies always rush in far more easily than they depart.
3. Utinam, fortissime Deus Israel, zelator animarum fidelium, respicias servi tui laborem et dolorem, adsistasque illi in omnibus ad quæcumque perrexerit. Robora me cælesti fortitudine, neque vetus homo, misera caro spiritui necdum bene subjecta valeat dominari, adversus quam certare oportebit, quamdiu spiratur in hac vita miserrima. Heu, qualis est hæc vita? Ubi non desunt tribulationes, et miseriæ; ubi plena laqueis, et hostibus sunt omnia. Nam una tribulatione seu tentatione recedente, alia accedit, sed et adhuc priore durante conflictu aliæ plures superveniunt et insperatæ.	3. Oh that Thou, most mighty God of Israel, Lover of all faithful souls, wouldst look upon the labour and sorrow of Thy servant, and give him help in all things whereunto he striveth. Strengthen me with heavenly fortitude, lest the old man, this miserable flesh, not being yet fully subdued to the spirit, prevail to rule over me; against which I ought to strive so long as I remain in this most miserable life. Oh what a life is this, where tribulations and miseries cease not, where all things are full of snares and of enemies, for when one tribulation or temptation goeth, another cometh, yea, while the former conflict is yet raging others come more in number and unexpected.
4. Et quomodo potest amari vita hominis habens tantas amaritudines, et tot subjecta calamitatibus et miseriis? Quomodo etiam dicitur vita tot generans mortes et pestes? Et tamen amatur, et delectari in ea quæritur a multis. Reprehenditur frequenter mundus tanquam fallax sit, et vanus, nec tamen facile relinquitur, cum concupiscentiæ carnis dominantur. Sed alia trahunt ad amandum, alia ad contemnendum, alia ad amorem mundi,carnis desiderium, desiderium oculorum et superbia vitæ;sed pœnæ et miseriæ sequentes ea odium mundi pariunt et tædiunt.	4. And how can the life of man be loved, seeing that it hath so many bitter things, that it is subjected to so many calamities and miseries. How can it be even called life, when it produces so many deaths and plagues? The world is often reproached because it is deceitful and vain, yet notwithstanding it is not easily given up, because the lusts of the flesh have too much rule over it. Some draw us to love, some to hate. The lust of the flesh, the lust of the eyes, and the pride of life, these draw to love of the world; but the punishments and miseries which righteously follow these things, bring forth hatred of the world and weariness.
5. Sed vincit, proh dolor, delectatio prava mentem mundo deditam, etesse sub sentibus delicias reputat, quia Dei suavitatem, et internam virtutis amœnitatem nec vidit nec gustavit. Qui qutem mundum perfecte contemnunt, et Deo vivere sub sancta disciplina student, isti dulcedinem divinam veris abrenuntiatoribus promissam non ignorant, et quam graviter mundus errat, et varie fallitur, vident.	5. But, alas! an evil desire conquereth a mind given to the world, and thinketh it happiness to be under the nettles because it savoureth not nor perceiveth the sweetness of God nor the inward gracefulness of virtue. But they who perfectly despise the world and strive to live unto God in holy discipline, these are not ignorant of the divine sweetness promised to all who truly deny themselves and see clearly how grievously the world erreth, and in how many ways it is deceived.
Cap. 21. Quod in Deo super omnia bona et dona requiescendum est.	HAPTER XXI That we must rest in God above all goods and gifts
1. Super omnia et in omnibus requiesces, anima mea, in Domino semper, quia ipse est Sanctorum æterna requies. Da mihi, dulcissime et amantissime Jesus, in te super omnem salutem, et pulchritudinem, super omnem gloriam et honorem, super omnem potentiam et dignitatem, super omnem scientiam et subtilitatem, et super omnes divitias et artes, super omnem lætitiam et exultationem, super omnem famam et laudem, super omnem suavitatem, et consolationem, super omnem spem et promissionem, super omne meritum et desiderium, super omnia dona et munera quæ potest dare et infundere, super omne gaudium et jubilationem, quam potest mens capere et sentire. Denique super omnes Angelos et Archangelos, et super omnem exercitum cæli et super omnia visibilia et invisibilia, et super omne, Deus meus, quod tu, non es: quia tu, Deus meus, super omnia optimus es.	1. Above all things and in all things thou shalt rest alway in the Lord, O my soul, for he himself is the eternal rest of the saints. Grant me, most sweet and loving Jesus, to rest in Thee above every creature, above all health and beauty, above all glory and honour, above all power and dignity, above all knowledge and skilfulness, above all riches and arts, above all joy and exultation, above all fame and praise, above all sweetness and consolation, above all hope and promise, above all merit and desire, above all gifts and rewards which Thou canst give and pour forth, above all joy and jubilation which the mind is able to receive and feel; in a word, above Angels and Archangels and all the army of heaven, above all things visible and invisible, and above everything which Thou, O my God, art not.
2. Tu solus altissimus, tu solus potentissimus, tu solus sufficientissimus et plenissimus, tu solus suavissimus et solatiosissimus, tu solus pulcherrimus et amantissimus, tu solus nobilissimus et gloriosissimus super omnia; in quo bona cuncta simul perfecta sunt, fuerunt et erunt. Atque ideo minus est et insufficiens quidquid præter te ipsum mihi donas, et de te ipso revelas, vel promittis, te non viso nec plene adepto: quoniam quidem non potest cor meum veraciter requiescere, nec totaliter contentari, nisi in te requiescat, et omnia dona omnemque creaturam transcendat.	2. For Thou, O Lord, my God, art best above all things; Thou only art the Most High, Thou only the Almighty, Thou only the All-sufficient, and the Fulness of all things; Thou only the All-delightsome and the All-comforting; Thou alone the altogether lovely and altogether loving; Thou alone the Most Exalted and Most Glorious above all things; in Whom all things are, and were, and ever shall be, altogether and all-perfect. And thus it falleth short and is insufficient whatsoever Thou givest to me without Thyself or whatsoever Thou revealest or dost promise concerning Thyself, whilst Thou art not seen or fully possessed: since verily my heart cannot truly rest nor be entirely content, except it rest in Thee, and go beyond all gifts and every creature.
3. O, mi dilectissime sponse Jesu Christe, amator purissime, dominator universæ creaturæ, quis mihi det pennas veræ libertatis, ad volandum et pausandum in te? O, quando ad plenum dabitur vacare mihi, et videre quam suavis es, Domine Deus meus? Quando ad plenum recolligam me in te, ut præ amore tuo non sentiam me, sed te solum supra omnem sensum et modum in modo non omnibus noto? Nunc autem frequenter gemo, et infelicitatem meam cum dolore porto, quia multa mala in hac valle miseriarum occurrunt, quæ me sæpius conturbant, et contristant et obnubilant, sæpius impediunt, et distrahunt, alliciunt et implicant, ne liberum accessum habeam ad te, et ne jucundis fruar amplexibus, præsto semper cum beatis spiritibus. Moveat te suspirium meum, et desolatio multiplex in terra.	3. O my most beloved Spouse, Jesus Christ, most holy lover of my soul, Ruler of this whole Creation, who shall give me the wings of true liberty, that I may flee to Thee and find rest? Oh when shall it be given me to be open to receive Thee to the full, and to see how sweet Thou art, O Lord my God? When shall I collect myself altogether in Thee, that because of Thy love I may not feel myself at all, but may know Thee only above every sense and measure, in measure not known to others. But now I ofttimes groan, and bear my sad estate with sorrow; because many evils befall me in this vale of miseries which continually disturb and fill me with sorrow, and encloud me, continually hinder and fill me with care, allure and entangle me, that I cannot have free access to Thee, nor enjoy that sweet intercourse which is always near at hand to the blessed spirits. Let my deep sighing come before Thee, and my manifold desolation on the earth.
4. O, Jesu splendor æternæ gloriæ, solamen peregrinationis animæ meæ, apud te est os meum sine voce, et silentium meum loquitur tibi. Usquequo tardat Deus meus venire? Veniat ad me pauperculum suum, et lætum faciat, mittat manum suam, et miserum eripiat de omni angustia. Veni, veni, quia nulla erit sine te quieta dies aut hora, quia tu lætitia mea, et sine te vacua est mensa mea. Miser sum, et quodammodo incarceratus, et compeditus ac gravatus, donec luce præsentiæ tuæ me reficias, ac libertati dones, et vultum amicabilem reddas ac demonstres.	4. O Jesus, Light of Eternal Glory, solace of the wandering soul, before Thee my mouth is without speech, and my silence speaketh to Thee. How long will my Lord delay to come unto me? Let Him come unto me, His poor and humble one, and make me glad. Let Him put forth His hand, and deliver His holy one from every snare. Come, Oh come; for without Thee shall be no joyful day or hour, for Thou art my joy, and without Thee is my table empty. I am miserable, and in a manner imprisoned and loaded with fetters, until Thou refresh me by the light of Thy presence, and give me liberty, and show Thy loving countenance.
5. Quærant alii pro te aliud quodcumque libuerit, et mihi aliud interim nihil placet, nec placebit, nisi Deus meus, spes mea, salus æterna. Non reticebo nec depræcari cessabo, donec gratia tua revertatur nihi, quia tu intus loquaris.	5. Let others seek some other thing instead of Thee, whatsoever it shall please them; but for my part nothing else pleaseth or shall please, save Thou, my God, my hope, my eternal salvation. I will not hold my peace, nor cease to implore, until Thy grace return, and until Thou speak to me within.
6. Ecce adsum, ecce ego ad te venio, quia invocasti me. Lacrymæ tuæ, et desiderium animæ tuæ, humiliatio tua, et contritio cordis inclinaverunt me, et adduxerunt ad te.	6. “Behold, here I am! Behold, I come to thee, for thou didst call Me. Thy tears and the longing of thy soul, thy humbleness and contrition of heart have inclined Me, and brought Me to thee.”
