4. Testimonium hominum sæpe salit; meum judicium verum est, stabit et non subvertetur. Latet plerumque, et paucis ad singula patet; numquam tamen errat, nec errare potest, etiamsi oculis insipientium non rectum videatur. Ad me ergo recurrendum est in omni judicio, nec proprio innitendum arbitrio;justusenimnon conturbabitur, quidquid a Deo ei acciderit.Et si injuste aliquid contra eum prolatum fuerit, non multum curabit; sed nec vane exultabit, si per alios rationabiliter excusetur. Pensat namque quia ego sumscrutans corda et renes;qui non judico secundum faciem et humanam apparentiam. Nam sæpe etiam oculis meis reperitur culpabile, quod hominum judicio creditur laudabile.	4. “The testimony of men often deceiveth. My judgment is true; it will stand, and it shall not be overturned. It commonly lieth hid, and only to few in certain cases is it made known; yet it never erreth, nor can err, although it seem not right to the eyes of foolish men. To Me, therefore, must men have recourse in all judgment, and must not lean to their opinion. For there shall no evil happen to the just, whatsoever may be sent to him by God. Even though some unjust charge be brought against him, he will care little; nor, again, will he exult above measure, if through others he be clearly vindicated. For he considereth that I am He who try the hearts and reins, who judge not outwardly and according to human appearance; for often in Mine eyes that is found blameworthy which in the judgment of men is held worthy of praise.”
5. Domine Deus, judex juste, fortis et patiens, qui hominum nosti fragilitatem et pravitatem, esto robur meum, et tota fiducia mea; non enim mihi sufficit conscientia mea. Tu nosti, quod ego non novi, et ideo in omni reprehensione me humiliare debui, et mansuete sustinere. Ignosce ergo mihi propitius, quoties sic non egi; et dona iterum gratiam amplioris sufferentiæ. Melior est enim mihi tua copiosa misericordia ad consecutionem indulgentiæ, quam mea opinata justitia pro defensione latentis conscientiæ.Et si mihi nihil conscius sum, tamen in hoc justificare me non possum: quiaremota misericordia tuanon justificabitur in conspectu tuo omnis vivens.	5. O Lord God, O Judge, just, strong, and patient, who knowest the frailty and sinfulness of men, be Thou my strength and my whole confidence; for my own conscience sufficeth me not. Thou knowest what I know not; and therefore ought I under all rebuke to humble myself, and to bear it meekly. Therefore mercifully forgive me as often as I have not done this, and grant me the next time the grace of greater endurance. For better unto me is Thine abundant pity for the attainment of Thy pardon, than the righteousness which I believe myself to have for defence against my conscience, which lieth wait against me. Although I know nothing against myself, yet I am not hereby justified, because if Thy mercy were removed away, in Thy sight should no man living be justified.
Cap. 47. Quod omnia gravia pro æterna vita sunt toleranda.	CHAPTER XLVII That all troubles are to be endured for the sake of eternal life
1. Fili, non frangant te labores quos assumsisti propter me, nec tribulationes te dejiciant usquequaque; sed mea promissio in omni eventu te roboret, et consoletur. Ego sufficiens sum ad reddendum supra omnem modum et mensuram. Non hic diu laborabis, nec semper gravaberis doloribus. Exspecta paulisper, et videbis celerem finem malorum. Veniet una hora, quando cessabit omnis labor et tumultus. Modicum est, et breve omne, quod transit cum tempore.	1. “My Son, let not the labours which thou hast undertaken for Me break thee down, nor let tribulations cast thee down in any wise, but let my promise strengthen and comfort thee in every event. I am sufficient to reward thee above all measure and extent. Not long shalt thou labour here, nor always be weighed down with sorrows. Wait yet a little while, and thou shalt see a speedy end of thine evils. An hour shall come when all labour and confusion shall cease. Little and short is all that passeth away with time.
2. Age quod agis; fideliter labora in vinea mea, ego ero merces tua. Scribe, lege, canta, geme, tace, ora, sustine viriliter contraria: digna est his omnibus et majoribus præliis vita æterna. Veniet pax in die una, quæ nota est Domino. Non enim erit dies vel nox hujus scilicet temporis, sed lux perpetua, claritas infinita, pax firma et requies secura. Non dices tunc:Quis me liberabit de corpore mortis hujus?Nec clamabis:Heu mihi, quia incolatus meus prolongatus est,quoniam præcipitabitur mors, et salus erit indefectiva, anxietas nulla jucunditas beata, societas dulcis et decora.	2. “Do earnestly what thou dost; labour faithfully in My vineyard; I will be thy reward. Write, read, sing, weep, be silent, pray, endure adversities manfully; eternal life is worthy of all these conflicts, yea, and of greater. Peace shall come in one day which is known to the Lord; which shall be neither day nor night, but light eternal, infinite clearness, steadfast peace, and undisturbed rest. Thou shalt not say then, Who shall deliver me from the body of this death? nor cry out, Woe is me, for my sojourning is prolonged , because death will be utterly destroyed, and there shall be salvation which can never fail, no more anxiety, happy delight, sweet and noble society.
3. O, si vidisses Sanctorum in cælo coronas perpetuas, quanta quoque nunc exultant gloria, qui huic mundo olim contemtibiles, et quasi vita ipsa indigni putabantur: profecto statim te humiliares usque ad terram et affectares potius omnibus subesse, quam uni præesse; nec hujus vitæ lætos dies concupisceres, sed magis pro Deo tribulari gauderes, et pro nihilo inter homines computari maximum lucrum duceres.	3. “Oh, if thou sawest the unfading crowns of the Saints in heaven, and with what great glory they now rejoice, who aforetime were reckoned by this world contemptibly and as it were unworthy of life, truly thou wouldst immediately humble thyself even to the earth, and wouldst desire rather to be in subjection to all, than to have authority over one; nor wouldst thou long for pleasant days of this life, but wouldst more rejoice to be afflicted for God’s sake, and wouldst esteem it gain to be counted for nought amongst men.
4. O, si tibi hæc saperent, et profunde ad cor transirent, quomodo auderes vel semel conqueri? Nonne pro vita æterna cuncta laboriosa sunt toleranda? Non est parvum quid lucrari, aut perdere regnum  Dei.  Leva igitur faciem tuam in cælo. Ecce ego et omnes Sancti mei mecum, qui in hoc sæculo magnum habuerunt certamen, modo gaudent modo consolantur modo securi sunt et modo requiescunt, et fine fine in regno Patris mei permanebunt mecum.	4. “Oh, if these things were sweet to thy taste, and moved thee to the bottom of thine heart, how shouldst thou dare even once to complain? Are not all laborious things to be endured for the sake of eternal life? It is no small thing, the losing or gaining the Kingdom of God. Lift up therefore thy face to heaven. Behold, I and all My Saints with Me, who in this world had a hard conflict, now rejoice, are now comforted, are now secure, are now at peace, and shall remain with Me evermore in the Kingdom of My Father.”
Cap. 48. De die æternitatis, et hujus vitæ angustiis.	CHAPTER XLVIII Of the day of eternity and of the straitnesses of this life
1. Supernæ civitatis mansio beatissima. O, dies æternitatis clarissima, quam nox non obscurat, sed summa veritas semper irradiat. Dies semper læta, semper secura et nunquam statum mutans in contraria. O, utinam dies illa illuxisset, et cuncta hæc temporalia finem accepissent. Lucet quidem Sanctis perpetua claritate splendida, sed non nisi a longe per speculum peregrinanatibus in terra.	1. Oh most blessed mansion of the City which is above! Oh most clear day of eternity which the night obscureth not, but the Supreme Truth ever enlighteneth! Day always joyful, always secure and never changing its state into those which are contrary. Oh would that this day might shine forth, and that all these temporal things would come to an end. It shineth indeed upon the Saints, glowing with unending brightness, but only from afar and through a glass, upon those who are pilgrims on the earth.
2. Norunt cæli cives, quam gaudiosa sit illa; gemunt exules filii Evæ quod amara et tædiosa sit ista. Dies hujus temporis parvi et mali, pleni doloribus et angustiis: ubi homo multis peccatis inquinatur, multis passionibus irretitur, multis timoribus stringitur, multis curis distenditur, et multis curiositatibus distrahitur, multis vanitatibus implicatur, multis erroribus circumfunditur, multis laboribus atteritur, multis tentationibus gravatur, deliciis enervatur, egestate cruciatur.	2. The citizens of heaven know how glorious that day is; the exiled sons of Eve groan, because this is bitter and wearisome. The days of this life are few and evil, full of sorrows and straits, where man is defiled with many sins, ensnared with many passions, bound fast with many fears, wearied with many cares, distracted with many questionings, entangled with many vanities, compassed about with many errors, worn away with many labours, weighed down with temptations, enervated by pleasures, tormented by poverty.
3. O, qundo erit finis horum multorum laborum? Quando liberabor a misera servitute vitiorum? Quando memorabor, Domine, tui solius? Quando ad plenum lætabor in te? Quando ero sine omni impedimento in vera libertate, sine omni gravamine mentis, et corporis? Quando erit pax solida, pax imperturbabilis et secura pax intus et foris, pax ab omni parte firma? Jesu bone, quando stabo ad videndum te? Quando contemplabor regni tui gloriam? Quando eris mihi omnia in omnibus? O, quando ero tecum in regno tuo, quod præparasit dilectis tuis ab æterno? Relictus sum pauper et exul in terra hostili, ubi bella quotidiana et infortunia maxima.	3. Oh when shall there be an end of these evils? When shall I be delivered from the wretched slavery of my sins? When shall I be mindful, O Lord, of Thee alone? When shall I rejoice in Thee to the full? When shall I be in true liberty without any impediment, without any burden on mind or body? When shall there be solid peace, peace immovable and secure, peace within and without, peace firm on every side? Blessed Jesus, when shall I stand to behold Thee? When shall I gaze upon the glory of Thy kingdom? When shalt Thou be to me all in all? Oh when shall I be with Thee in Thy Kingdom which Thou hast prepared from the foundation of the world for them that love Thee? I am left destitute, an exile in a hostile land, where are daily wars and grievous misfortunes.
4. Consolare exilium meum, mitiga dolorem meum, quia ad te suspirat omne desiderium meum. Nam onus totum mihi est, quidquid hic mundus offert ad solatium, desidero te intime frui, sed nequeo apprehendere. Opto inhærere cælestibus, sed deprimunt res temporales, et immortificatæ passiones. Mente omnibus rebus superesse opto, carni autem invite subesse cogor. Sic ego infelix homo mecum pugno et factus sum mihimetipsi gravis, dum spiritus sursum, et caro quærit esse deorsum.	4. Console my exile, mitigate my sorrow, for towards Thee all my desire longeth. For all is to me a burden, whatsoever this world offereth for consolation. I yearn to enjoy Thee intimately, but I cannot attain unto it. I long to cleave to heavenly things, but temporal things and unmortified passions press me down. In my mind I would be above all things, but in my flesh I am unwillingly compelled to be beneath them. So, wretched man that I am, I fight with myself, and am made grievous even unto myself, while the spirit seeketh to be above and the flesh to be beneath.
5. O, quid intus patior, dum mente cælestia tracto et mox carnalium tentationum et cogitationum turba occurit oranti.Deus meus, ne elongeris a meneque declines in ira a servo tuo.Fulgura coruscationem tuam et dissipaeas,emitte safittas tuaset conturbentur omnes phantasiæ inimici. Recollige omnes sensus meo ad te; fac me oblivisci omnium mundanorum; da cito abjicere et contemnere phantasmata vitiorum. Succurre mihi, æterna Veritas, ut nulla me moveat vanitas. Adveni, cælestis suavitas, et fugiat a facie tua omnis impuritas. Ignosce quoque mihi, et misericorditer indulge, quoties præter te aliud in oratione revolvo. Confiteor etenim vere, quia valde distracte me habere consuevi. Nam ibi multoties non sum, ubi corporaliter sto, aut sedeo, sed ibi magis sum, ubi cogitationibus feror. Ibi sum, ubi cogitatio mea est; ubi est frequenter cogitatio mea, ibi est id quod amo. Hoc mihi cito occurrit, quod naturaliter delectat aut ex usu placet.	5. Oh how I suffer inwardly, while with the mind I discourse on heavenly things, and presently a crowd of carnal things rusheth upon me whilst I pray. My God, be not Thou far from me, nor depart in wrath from Thy servant. Cast forth Thy lightning and scatter them; send out Thine arrows, and let all delusions of my enemy be confounded. Recall my senses unto Thyself, cause me to forget all worldly things; grant me quickly to cast away and despise the imaginations of sin. Succour me, O Eternal Truth, that no vanity may move me. Come unto me, O Heavenly Sweetness, and let all impurity flee from before Thy face. Pardon me also, and of Thy mercy deal gently with me, whensoever in prayer I think on anything besides Thee; for truly I confess that I am wont to be continually distracted. For often and often, where in the body I stand or sit, there I myself am not; but rather am I there, whither I am borne by my thoughts. Where my thought is, there am I; and there commonly is my thought where that which I love is. That readily occurreth to me, which naturally delighteth, or pleaseth through custom.
6. Unde tu, Veritas æterna, aperte dixisti:Ubi enim est thesaurus tuus, ibi est et cor tuum.Si cælum diligo, libenter de cælestibus penso. Si mundum amo, felicitatibus mundi congaudeo, et de adversitatibus ejus tristor. Si carnem diligo, quæ carnis sunt sæpissime imaginor. Si spiritum amo, de spiritualibus cogitare delector. Quæcumque enim diligo, de his libenter loquor et audio, atque talium imagines mecum ad domum reporto. Sed beatus ille homo qui propter te, Domine, omnibus creaturis abeundi licentiam tribuit, qui naturæ vim facit et concupiscentias carnis fervore spiritus crucifigit, ut serenata conscientia, puram tibi orationem offerat, dignusque sit angelicis interesse choris, omnibus terrenis foris et intus exclusis.	6. Wherefore Thou, who art the Truth, hast plainly said, Where your treasure is, there will your heart be also. If I love heaven, I gladly meditate on heavenly things. If I love the world, I rejoice in the delights of the world, and am made sorry by its adversities. If I love the flesh, I am continually imagining the things which belong to the flesh; if I love the spirit, I am delighted by meditating on spiritual things. For whatsoever things I love, on these I readily converse and listen, and carry home with me the images of them. But blessed is that man who for Thy sake, O Lord, is willing to part from all creatures; who doth violence to his fleshly nature and crucifieth the lusts of the flesh by the fervour of his spirit, so that with serene conscience he may offer unto Thee a pure prayer, and be made worthy to enter into the angelic choirs, having shut out from himself, both outwardly and inwardly, all worldly things.
Cap. 49. De desiderio æternæ vitæ, et quanta sint certantibus præmia promissa.	CHAPTER XLIX Of the desire after eternal life, and how great blessings are promised to those who strive
1. Fili mi, cum tibi desiderium æternæ beatitudinis desuper infundi sentis, et de tabernaculo corporis exire concupiscis, ut claritatem meam sine vicissitudinis umbra contemplari possis, dilata cor tuum, et omni desiderio hanc sanctam inspirationem suscipe. Redde amplissimas supernæ bonitati gratias, quæ tecum sic dignanter agit, clementer visitat, ardenter excitat, potenter sublevat, ne proprio pondere ad terrena labaris. Neque enim hoc cogitatu tuo aut conatu accipis, sed sola dignatione supernæ gratiæ et divini respectus, quatenus in virtutibus, et majori humilitate proficias et ad futura certamina te præpares mihique toto cordis affectu adhærere et serventi voluntate studeas deservire.	1. “My Son, when thou feelest the desire of eternal happiness to be poured into thee from above, and longest to depart from the tabernacle of this body, that thou mayest contemplate My glory without shadow of turning, enlarge thine heart, and take in this holy inspiration with all thy desire. Give most hearty thanks to the Supreme Goodness, who dealeth with thee so graciously, visiteth thee so lovingly, stirreth thee up so fervently, raiseth thee so powerfully, lest thou sink down through thine own weight, to earthly things. For not by thine own meditating or striving dost thou receive this gift, but by the sole gracious condescension of Supreme Grace and Divine regard; to the end that thou mayest make progress in virtue and in more humility, and prepare thyself for future conflicts, and cleave unto Me with all the affection of thy heart, and strive to serve Me with fervent will.
2. Fili, sæpe ignis ardet, sed sine fumo flamma non ascendit. Sic et aliquorum desideria ad cælestia flagrant et tamen a tentatione carnalis affectus liberi non sunt. Idcirco nec omnino pure pro honore Dei agunt quod tam desideranter ab eo petunt. Tale est et sæpe desiderium tuum, quod insinuasti fore tam importunum. Non enim est hoc purum et perfectum, quod propria commoditate est infectum.	2. “My Son, often the fire burneth, but the flame ascendeth not without smoke. So also the desires of some men burn towards heavenly things, and yet they are not free from the temptation of carnal affection. Thus therefore they are not acting with an altogether simple desire for God’s glory when they pray to Him so earnestly. Such, too, is oftentimes thy desire, when thou hast imagined it to be so earnest. For that is not pure and perfect which is tainted with thine own self-seeking.
3. Pete non quod tibi est delectabile et commodum, sed quod mihi acceptabile atque honorificum; quia si recte judicas meam ordinationem tuo desiderio, et omni desiderato præferre debes, ac sequi. Novi desiderium tuum, et frequentes gemitus audivi. Jam velles esse in libertate gloriæ filiorum Dei, jam te delectat domus æterna, et cælestis patria gaudio plena. Sed nondum venit hora ista; sed est adhuc, est aliud temus belli, videlicet tempus laboris et robatinis. Optas summo repleri bono, sed non potes hoc assequi modo. Ego sum, exspecta me, dicit Dominus, donec veniat regnum Dei.	3. “Seek thou not what is pleasant and advantageous to thyself, but what is acceptable and honourable unto Me; for if thou judgest rightly, thou must choose and follow after My appointment rather than thine own desire; yea, rather than anything that can be desired. I know thy desire, and I have heard thy many groanings. Already thou longest to be in the glorious liberty of the children of God; already the eternal home delighteth thee, and the heavenly country full of joy; but the hour is not yet come; there remaineth still another season, even a season of warfare, a season of labour and probation. Thou desirest to be filled with the Chief Good, but thou canst not attain it immediately. I AM that Good; wait for Me, until the Kingdom of God shall come.
4. Probandus es adhuc in terris et in multis exercitandus. Consolatio interdum tibi dabitur, sed copiosa satietas non concedetur. Confortare igitur et esto robustus, tam in agendo quam in patiendo naturæ contraria. Oportet te novum induere hominem, et in alterum virum mutari. Oportet te sæpe agere quod non vis, et quod vis oportet te relinquere. Quod aliis placet, processum habebit; quod tibi placet, ultra non proficiet. Quod alii dicunt, audietur; quod tu dicis, pro nihilo computabitur. Patent alii, et accipient; tu petes nec impetrabis.	4. “Thou must still be tried upon earth, and be exercised in many things. Consolation shall from time to time be given thee, but abundant satisfying shall not be granted. Be strong therefore, and be thou brave both in working and in suffering things which are against thy nature. Thou must put on the new man, and be changed into another man. Thou must often do what thou wouldst not; and thou must leave undone what thou wouldst do. What pleaseth others shall have good success, what pleaseth thee shall have no prosperity. What others say shall be listened to; what thou sayest shall receive no heed. Others shall ask and receive; thou shalt ask and not obtain.
5. Erunt alii magni in ore hominum; de te autem tacebitur. Aliis hoc vel illud committetur, tu autem ad nihil utilis judicaberis. Nam propter alium natura contristabitur, sed magnum fructum sibi silens reportabit. In his et similibus multis probari solet fidelis Domini servus, qualiter se in omnibus abnegare, et in omnibus frangere quærit. Vix est aliquid tale, in quo tantundem mori indiges, sicut videre et pati, quæ voluntati tuæ adversa sunt; maxime autem cum disconvenientia, et quæ minus tibi utilia apparent, fieri jubentur. Et quia non audes resistere altiori potestati, sub dominio constitutus, ideo durum tibi videtur ad nutum alterius ambulare, et omne proprium sentire omittere.	5. Others shall be great in the report of men, but about thee shall nothing be spoken. To others this or that shall be entrusted; thou shalt be judged useful for nought. “For this cause nature shall sometimes be filled with sadness; and it is a great thing if thou bear it silently. In this and many like things the faithful servant of the Lord is wont to be tried, how far he is able to deny himself and bring himself into subjection in all things. Scarcely is there anything in which thou hast need to mortify thyself so much as in seeing things which are adverse to thy will; especially when things are commanded thee to be done which seem to thee inexpedient or of little use to thee. And because thou darest not resist a higher power, being under authority, therefore it seemeth hard for thee to shape thy course according to the nod of another, and to forego thine own opinion.
6. Sed pensa, fili, horum fructum laborum, celerem finem atque præmium nimis magnum, et non habebis inde gravamen, sed fortissimum patientiæ tuæ solamen. Nam et pro modica hac voluntate, quam modo sponte deseris, habebis semper voluntatem tuam in cælis. Ibi quippe invenies omne quod volueris, omne quod desiderare potes. Ibi aderit tibi totius facultas boni sine timore amittendi. Ibi voluntas tua una semper mecum; nil cupies extraneum vel privatum. Ibi nullus resistet tibi, nemo de te conqueretur, nemo te impediet, nihil obviabit: sed cuncta desiderata simul erunt præsentia, totumque tuum affectum reficient, et adimplebunt usque ad summum. Ibi reddam gloriam pro contumelia perpessa, pallium laudis pro mærore, pro loco novissimo sedem regni in sæcula. Ibi apparebit fuctus obedientiæ; gaudebit labor pœitentiæ, et humilis subjectio coronabitur gloriose.	6. “But consider, My Son, the fruit of these labours, the swift end, and the reward exceeding great; and thou shalt find it no pain to bear them then, but rather the strongest solace of thy patience. For even in exchange for this trifling desire which thou hast readily forsaken, thou shalt always have thy will in Heaven. There verily thou shalt find all that thou wouldst, all that thou canst long for. There thou shalt have all good within thy power without the fear of losing it. There thy will, ever at one with Mine, shall desire nothing outward, nothing for itself. There no man shall withstand thee, none shall complain of thee, none shall hinder, nothing shall stand in thy path; but all things desired by thee shall be present together, and shall refresh thy whole affection, and fill it up even to the brim. There I will glory for the scorn suffered here, the garment of praise for sorrow, and for the lowest place a throne in the Kingdom, for ever. There shall appear the fruit of obedience, the labour of repentance shall rejoice, and humble subjection shall be crowned gloriously.
7. Nunc ergo te inclina humliter sub omnium manibus, nec sit curæ, quia hoc dixerit, ve jusserit: sed hoc magno opere curato, ut sive Prælatus, sive minor au æqualis aliud a te exposcerit vel innuerit, pro bono totum accipias, et sincera voluntate studeas adimplere.  Quærat alius hoc, alius illud; glorietur ille in illo, et iste in isto; laudenturque millies mille, tu autem nec isto nec illo: sed tui ipsius gaude contemtu, et in mei solius beneplacito ac honore. Hoc optandum est tibi, ut sive per vitam sive per mortem Deus semper in te glorificetur.	7. “Now therefore bow thyself humbly under the hands of all men; nor let it trouble thee who said this or who ordered that; but take special heed that whether thy superior, thy inferior, or thy equal, require anything from thee, or even show a desire for it; take it all in good part, and study with a good will to fulfil the desire. Let one seek this, another that; let this man glory in this, and that man in that, and be praised a thousand thousand times, but rejoice thou only in the contempt of thyself, and in Mine own good pleasure and glory. This is what thou art to long for, even that whether by life or by death God may be ever magnified in thee.”
Cap. 50. Qualiter homo defolatus debet se in manus Dei offerre.	CHAPTER L How a desolate man ought to commit himself into the hands of God
